title,description,season,episode,episode_title,content,genre
꿈빛 파티시엘,케이크를 잘 먹는 것 외에 어떠한 장점도 없다고 생각했던 14세 여자아이 아마노 이치고. “할머니의 딸기타르트 맛을 재현하고 싶어!”라며 꿈을 이루기 위해 세인트 마리 학교에 전학한 아마노 이치고는 학원에 전해 내려오는 전설의 스위트 요정과 만나게 된다.,1,1,"あたし、パティシエールになる!
난 파티시엘이 될 거야!","Ichigo Amano, a middle schooler with no particular talent, meets a pâtissier (Henri Lucas) who realizes that she has an incredible palate one day at a sweets festival. He asks her to transfer to a special school for pâtissiers (male) and pâtissières (female) called ""St. Marie Academy"".","로맨스, 학원, 요리, 성장"
,,1,2,"伝説のスイーツ精霊スピリッツ?
전설의 스위트 요정","Ichigo transfers to St. Marie Academy and is overwhelmed by the school. She encounters three boys (aka Sweets Princes) on the way to class, each one of them is a talented pâtissier. Ichigo is then placed in Group A with them, despite being a beginner.",
,,1,3,"バラのスイーツ王子
장미의 스위트 왕자","Ichigo has a hard time with the extreme course-load at St. Marie and starts to get homesick. She is cheered up by Hanabusa, one of the boys in her group.",
,,1,4,"ケーキなんか大嫌いだ!
난 케이크가 정말 싫어!","There's a special salon at St. Marie Academy (which is run by the High School student council) called Salon de Marie. Ichigo would give anything to work there, but because she's in middle school, her chances are slim. Andou asks her to come with him to his family's Japanese confectionery to help get her mind off things. There, she finds out that the eldest out of Andou's 4 younger siblings, Ichita, dislikes cake, so she decides to find out why.",
,,1,5,"天使? 悪魔? 精霊スピリッツ??
천사? 악마? 요정?","Kashino is extremely skilled with chocolate; so with a chocolate test coming up, Ichigo decides to make a chocolate cake that will blow him away.",
,,1,6,"ぴよぴよ幼稚園のお誕生会
병아리 유치원의 생일 파티","Ichigo finds all three of the Sweets Princes also have accompanying Sweets Spirits. On a trip to a local preschool, Ichigo notices a little girl named Ringo that seems to be having trouble making friends, and promises her that she will make a cake that will help her to make friends with everyone else in the class.",
,,1,7,"仲良し誕生日バースデーケーキ
특별한 생일 케이크","Group B stole the cake Ichigo designed in order to embarrass her because she is with the Sweets Princes. With little time to spare, Group A must design a new cake to be presented to Ringo for her birthday.",
,,1,8,"天才と天敵と天然?
천재와 천적의 만남?","Ichigo's roommate and friend, Rumi, goes home and leaves her alone. Group B invited her to gather walnuts and she is intentionally misled by them. Fortunately, the High School student council president, Mari Tennouji, rescues Ichigo. Later, Ichigo learns about the Cake Grand Prix, a competition held at St. Marie where winners get to go to Paris to study. Ichigo and the rest of Group A decide to team up for the competition, but a girl named Miya (known as the Heiress) shows up and claims that she will be the one to work with Group A, leading a showdown between her and Ichigo.",
,,1,9,"運命のプリン対決!!
운명의 푸딩 대결","Ichigo, with the help of Caramel and Vanilla, stays up all night the night before her showdown with the Heiress to practice making pudding. She ends up winning due to a few factors, and finds out that Mari Tennouji also has a Sweets Spirit named Honey. Group A is upset at Ichigo's attitude towards her win, and when Vanilla tries to explain, Ichigo doesn't listen. Vanilla gets upset as well and claims that she will no longer be her partner.",
,,1,10,"思いでのイチゴタルト
추억의 딸기 타르트","Upset that she made her friends mad, Ichigo runs back home without telling anyone. Her family greets her happily, not having known that she ran away because she told them that she was on an early Winter break. But, Ichigo quickly tells them the truth after her mom hangs up the phone and tells them her plans to transfer from St. Marie. The next day, Ichigo and her family visit her deceased grandmother's pastry shop, now run by her uncle. Ichigo and her sister help their uncle make sweets. After discovering that Vanilla followed her and remembering the happiness her grandmother's sweets brought her, Ichigo decides to go back to St. Marie. Her uncle gives her her grandmother's recipe notebook and she heads back to school, where she finds the Sweets Princes waiting for her to apologize for what they said to her.",
,,1,11,"王子達の友情マドレーヌ
왕자들의 우정 마들렌","The Sweets Princes tells Ichigo about how they first met, got their Sweets Spirits, and became friends over each other's madeleines.",
,,1,12,"七年目のメリークリスマス
7년만의 메리 크리스마스","At St. Marie's annual Christmas cake charity event, Ichigo encounters a customer who seems very depressed. When she and her group hear his story about his lost love seven years prior, they decide to help him have a Merry Christmas.",
,,1,13,"ハッピー・スイーツ・ドリーム
해피 스위트 드림","While everyone else heads home for New Year's break, Ichigo stays behind at school to practice. When Vanilla asks her to visit the Sweets Kingdom, she agrees eagerly. While Vanilla and the rest of the court Sweets Spirits prepare for their annual New Year's Festival, Ichigo encounters a group of bandits who are known as ""The Jerks"".",
,,1,14,"開幕! ケーキグランプリ
케이크 그랑프리 개막!","The Sweets Princes give Ichigo a crash course to help her through the preliminary section of the Cake Grand Prix. Due to the fact that too many middle school teams entered this year, they find out at the beginning of the exam that there is a new individual section. If Ichigo fails, the whole of Group A will fail.",
,,1,15,"想い出のローズウォーター
눈물의 로즈 워터","In the first round of the Cake Grand Prix, Group A is up against a group of third-year boys and a girl who have their sweets featured in Salon de Marie. Ichigo, Kashino, and Andou are easily able to come up with their pound cakes. But Hanabusa can't seem to get his rose water pound cake to come out the way he wants it too. He then gets frustrated and runs away, but Ichigo follows him. He explains to her (because she's a girl) that the rose water was a gift from his deceased father and how important it was to him.",
,,1,16,"スイートローズメモリー
행복한 장미의 기억","Hanabusa decides to abandon his rose water pound cake, and angrily throws the bottle into a pond. But Ichigo jumps in after it. After noticing that the pond water left a smell on Ichigo and Kashino (who jumped in after her), Hanabusa has an idea for his cake. When he had his cake to be like the way he wanted it to be, Ichigo suggests that the group should change their pound cake recipes and has to stay up all night to perfect their four cakes. The next day at the Cake Grand Prix match, they show the audience that they had to change the recipes so that they would match Hanabusa's rose water cake (well, most parts of the explanation appeared in sort of a flash back). Because they made cakes that all accented one another instead of overpowering each other, Team Ichigo wins the match.",
,,1,17,"パティシエール対決!
파티시엘 대결","One of Ichigo's classmates, Hayami, mentions that Ichigo doesn't deserve to be in the same group at the Sweets Princes due to her lack of skills. However, Hayami and the rest of Group F continually slack off in class and she, however, seemingly doesn't care about sweets. Ichigo has a feeling that something isn't quite right and found out that Hayami was originally in Group C (but dropped to Group F after her sickness and fever during the final exam). Even worse, Hayami is currently planning to transfer out of St. Marie.",
,,1,18,"樫野家のビターな事情
달콤 쌉싸름한 비밀","Ichigo falls down the stairs and is taken to the local hospital by the Sweets Princes. Kashino doesn't seem to want to go into the building. Ichigo notices that all the doctors are named Kashino at the hospital and the group finds out that Kashino's family owns the hospital. Kashino's sister shows up and has him kidnapped. Ichigo, Andou, Hanabusa and the Sweets Spirits finds out and follows him.",
,,1,19,"ハッピー・バレンタイン
해피 발렌타인","Ichigo goes shopping with Rumi for Valentine's chocolate when they run into the Heiress, and challenged Ichigo to a chocolate-making duel that is to be held on Valentine's Day at the party sponsored by the Heiress's father. At the party, they end up having a tie and Ichigo danced with the Sweets Princes.",
,,1,20,"強敵!? パリからの転校生
파리에서 온 전학생","Team Ichigo is up against the only first year group in the quarterfinals of the middle school round of the Cake Grand Prix, whose leader, Lemon, is a transfer student from the original campus in Paris.",
,,1,21,"友情の抹茶ガトーショコラ
우정의 녹차 가토 쇼콜라","The rematch for Team Ichigo and Lemon's quarterfinal match is scheduled and the theme of ""friendship"" is chosen, but Andoh ran away. Ichigo, Kashino, and Hanabusa follow him home to make him change his mind about quitting St. Marie.",
,,1,22,"約束の絶品スイーツ
바움쿠헨의 약속","Vanilla knocks over Ichigo's alarm clock, causing her to oversleep. When she trips down the stairs, the dorm mistress gives her some http://en.wikipedia.org/wiki/Baumkuchen she made as Ichigo skipped breakfast. When she sees the dorm mistress arguing with her husband (who is also the head of the boys' dorm), she decides to meddle.",
,,1,23,"いちご・イリュージョン?
서커스 소녀 아멜리","A circus group from France is coming to perform near Andou's home, and Ichita wants to go see it. Ichigo, Ichita and the gang go to see the circus' performance, where Ichita spots a blonde girl performing. After the show, Ichigo and Ichita get separated from the group and meets the blonde girl Ichita previously spotted (whose name is Ameli). Ichita gives Amelie some cookies, and she invites them to her mobile home in repayment for the delicious cookies. When they arrived at their mobile house, Ameli's mother offered them to eat curry and some spinach salad. Ameli doesn't like the carrots in the curry while Ichita hates the spinach in the salad. Ichigo makes a dessert, containing both spinach and carrot which neither Ichita nor Ameli enjoyed it. Back at the academy, Ichigo works hard to make a spinach and carrot cake but can't get it right without Andou's help. They let Ichita taste it and after he approves, they rush to get it to Ameli, who is moving with the circus.",
,,1,24,"愛のチョコケーキ対決!
사랑의 초콜릿 케이크?!","Teams participating in the semi-finals of the Cake Grand Prix are required to make a chocolate cake using the theme of ""love"". Team Ichigo is up against the Heiress's team (Team Koshiro). They bet that if Team Ichigo loses, Kashino has to join their team. The usual, confident chocolatier, Kashino, dislikes the theme and leaves the deciding of the type of cake to make and design of the cake to his fellow teammates. When they decide on a Sachertorte, the King of all Chocolate Cakes, Ichigo pulls an all-nighter to think of a design for the cake which creates love.",
,,1,25,"さよなら樫野
빼앗긴 가온이","Team Ichigo and Team Koshiro go against each other in the Semi-Finals and Team Ichigo is confident because the battle is based on chocolate. They are about to start when Ichigo finds out that she showed her design to the opposing team and they are using a similar design! They do not have enough time to change the design of the cake, so the cake looks like Team Koshiro's cake. The judges know that one team has cheated by the talk they are having during the competition. Although they know this, they do not know whose design it really was or who stole the design. The two teams battle it out to see who wins. But what's really on the line is to see if Team Ichigo gets to keep Kashino.",
,,1,26,"オジョー帝国の悪夢!
공주 제국의 악몽","Team Ichigo has lost to Team Koshiro and Kashino now must join Team Koshiro. Kashino is participating in Team Koshiro's practicals without reluctance but Hanabusa and Andoh believe that he will return, leaving a hesitant Ichigo with no choice but to continue practicing for their next match in the Grand Prix's third place round. Will Kashino return to Team Ichigo like their beliefs?",
,,1,27,"サプライズスイーツ
요정들의 시험","An examiner arrives from the Sweets Kingdom and tells Vanilla, Chocolat, Caramel and Cafe that they have not sent enough Sweets Cards to the Queen. Therefore, they must take a supplementary exam. The examiner told them they are not allowed to return to the human world unless they pass. Meanwhile, Chocolat feels lonely when she sees that the other spirits being very close to their partners and leaves for the Sweets Kingdom without telling Kashino.",
,,1,28,"イチゴとなつめと王子さま
딸기와 다래와 왕자님","Team Ichigo decides to split up to train individually for the weekend. Ichigo decides to go to her uncle's shop, but finds that it's closed, so heads home for the weekend. She finds her parents upset over the fact that Natsume is thinking of quitting piano. Ichigo tries to cheer her up with the same strawberry tart that her grandmother made for her when she was younger. The Sweets Princes show up after their plans all fall through and make a special cake for Natsume as well.",
,,1,29,"絆のミルクレープ
인연의 밀크레이프","The third place competition theme has been announced that it is ""bonds."" After Team Ichigo is caught slacking in class, their teacher, Ameya-sensei, suggests them not to think about the competition until the day off. She makes the whole class do the most basic lessons until the day of the competition, making Team Ichigo wonder if there's a point.",
,,1,30,"ミラクルチーズケーキ
미라클 치즈 케이크","Team Ichigo goes to a ranch to study on the ingredients that were used to make a cheesecake. At the same time, Caramel is having trouble writing a report to the Sweets Kingdom. While playing with the farm animals, Caramel is chased by a calf and gets lost. The Vanilla, Chocolat and Café chase after Caramel.",
,,1,31,"姫とオジョー
공주와 여왕","The theme for the first round of the main tournament of the Cake Grand Prix is ""elegance"" and Team Ichigo is up against Team Tachibana, a group of girls known as the ""Country Girls"" for only using organic and non-artificial ingredients. Team Ichigo decides to base their cake on the Heian period because it was an era which exemplifies the idea of elegance and win because Team Tachibana's creation falls apart.",
,,1,32,"トロピカル・パラダイス!
트로피컬 파라다이스","Team Ichigo goes to a local sweets festa to research for the next round of the Cake Grand Prix. Ichigo runs off looking at all the sweets and the boys are left to chase after her. While waiting with Kashino, Ichigo meets a girl named Natsuki, who offers to take them to one of the local shops. The shop serves fresh fruit sweets, which later turns out to the be the theme for the Grand Prix. Team Ichigo is up against Team Natsuki, the same girls who served them fruit at the sweets festa.",
,,1,33,"ストロベリー・パニック!
스트로베리 패닉!","Team Ichigo goes to a local sweets festa to research for the next round of the Cake Grand Prix. Ichigo runs off looking at all the sweets and the boys are left to chase after her. While waiting with Kashino, Ichigo meets a girl named Natsuki, who offers to take them to one of the local shops. The shop serves fresh fruit sweets, which later turns out to the be the theme for the Grand Prix. Team Ichigo is up against Team Natsuki, the same girls who served them fruit at the sweets festa.",
,,1,34,"史上最強のコンビ!
사상 최강의 콤비","Marron comes from the Sweets Kingdom to find a partner. Vanilla, Cafe, Caramel, and Chocolat show her to the Heiress's classroom as they think Marron and Miya are similar, but Marron doesn't like what she sees, so she tries to force the Sweets Princes into the job, but they all refuse. Marron sees Tennoji and almost asks her, but she sees Tennoji already has Honey. When Marron almost leaves to Paris from the cooking room oven, Miya barges in all of a sudden. Marron becomes interested in her and they become partners.",
,,1,35,"ようこそ、アンリ先生
돌아온 앙리 선생님","Ichigo is surprised to hear that Henri-sensei coming back. She gets excited and loses concentration in class and cancels practice troubling the Sweets Princes. She decides to bake the cake 'First love' from when she met Henri-sensei, but loses enthusiasm as she finds Mari Tennouji happily sharing her latest cake with him. Henri-sensei later reveals that he is one of the judges for the final round of the Cake Grand Prix.",
,,1,36,"決戦前夜!
결전 전야","Team Ichigo is told that the theme for the finals won't be revealed until the actual day, so they begin training using high school textbooks to combat Team Tennouji's high level cakes. After being told by Tennouji that she'll never catch up to her in the time she has before the finals, Ichigo tries to figure out what she means by that. After a conversation with Natsume, Ichigo decides to train herself in the basics as she lacks experience with them. Team Ichigo's sweets spirits decide to bake sweets to cheer up their partners.",
,,1,37,"ゆずれない想い
양보할 수 없는 마음","The theme for the finals is ""Dream"" and each team has a day to come up something before making the actual piece on the 2nd day. Team Ichigo initially has trouble deciding what to make, but soon come up with an idea. While Ichigo is thinking up what to put in her Petite Gateaux, she runs into Tennouji. After hearing Ichigo's story about her first meeting with Henri-sensei and about her Grandmother, Tennouji reveals her past and her relationship with Henri-sensei and makes her battle declaration.",
,,1,38,"閉ざされた道
도전의 끝","The final showdown of the grand prix has come. As usual, Team Tenouji are amazing but Team Ichigo has trouble. Kashino is responsible for the toughest job on the team and passes out. Team Tennouji ends up winning the Grand Prix by one point, but Henri-sensei announces that because Team Ichigo did so well, they are also being invited to go to Paris for the World Grand Prix.",
,,1,39,"消えたレシピ
사라진 레시피","Team Ichigo returns to their homes in order to prepare for the World Cake Grand Prix in Paris. However, Kashino's family who is against him becoming a patissier refuse to sign the form. Meanwhile, Ichigo is also having trouble with her dad who is being stubborn about her not going to Paris. The old dirty spoon that Ichigo was given to when she went to the Sweets Kingdom shines. Ichigo and Vanilla uses it to unlock her grandma's notebook. Ichigo's grandma's recipes can finally be read. Ichigo looks through her grandma's notebook but her strawberry tart recipe has been completely erased. Just what is that old spoon? Could it be that Ichigo's grandma also had a sweets spirit?",
,,1,40,"ボンジュール! パリ
봉쥬르! 파리","While touring around Paris, Ichigo gets lost on the subway and meets Ricardo, an international student from Italy and also a representative of the team from the main branch. When she meets up with Kashino and the others, the Sweets Princes got envious as Ricardo flirts with her. At the Cake Grand Prix welcoming party, Team Ichigo meets up with Lemon who is a member of Ricardo's Team. Also, The sweets spirits have to do an obstacle course in order to determine the drawings for the matches. The Heiress returns and the results of the drawing is Team Ichigo vs Team Ricardo.",
,,1,41,"4人目のスイーツ王子?
네번째 스위트 왕자?","The judges have announced the theme for the next match, which is ""food wagon"", but Team Ichigo's oven breaks down leaving them in a big pinch. But having heard the explosion, the landlady gives them a heavy-duty vacuum cleaner and tells the story about her gelato shop she shut down three years ago. Furthermore, while preparing for the match, Team Ichigo decides to make gelato for the competition and meets Ricardo in town. While the 3 Sweets Princes continue to give Ricardo that jealous look, he announces that Ichigo will become his girlfriend if his team wins the match.",
,,1,42,"幸せのジェラート
행복의 젤라또","Team Ichigo takes their ideas to their landlady's gelato shop, where they practice making gelato. However, the landlady tells them that if they don't come up with a unique flavor for their gelato they will never win the competition. They brainstorm and come up with a sakura salt flavor. They manage to create 4 flavors: Kashino, who made rum raisin, Andoh who made pistachio, Hanabusa who made peach, and sakura sea salt they three succeed into making with some of Ichigo's ideas. On the day of the competition, Team Ichigo manages to beat Team Ricardo's doughnuts by one point. And with that, Teams Tennouji, Ichigo, Koshiro, and François advance onto the semi-finals.",
,,1,43,"オランジュの木の下で
오렌지 나무 아래에서","Team Ichigo decided to split into two groups and go to separate pâtisserie to do some practical training. Ichigo and Kashino goes to a small three-star pâtisserie owned by someone named Mr Blanc, despite his scary-looking face, his sweets are top-class, while Hanabusa and Andoh goes to a four-star hotel which have a three-star pâtisserie in it. Hanabusa and Andoh got into the kitchen quickly to make some sweets, but Ichigo and Kashino have to do menial tasks such as wiping the windows, gather the ingredients, etc. After witnessing Ichigo dancing under the orange tree, Monsieur Blanc invites them to the kitchen, only to have them wash dishes. In Pâtisserie Blanc's backyard, despite the existence of an orange tree, there are no sweets that use oranges on the menu which makes Ichigo worried. Ichigo and Kashino decide to make tarte à l'orange to show their gratitude to Monsieur Blanc in the last day of training. When he tastes it, he's surprised; for that à l'orange tastes like the one his late wife made. He begins to make orange sweets in his pâtisserie again.",
,,1,44,"チョコレート・プリンセス
초콜릿 프린세스","Team Ichigo and Team Koshiro are invited to a ball on Mont Saint-Michel by an anonymous letter which has the St. Marie Academy emblem on it. Henri's secretary appears and ushers them to the ballroom in the Saint-Michel castle. It turns out that the castle is the venue for the semi-finals, the theme of which is a dress made of chocolate. Team Ichigo decides to make a dress by basing the design with the fairy tale Cinderella. Kashino, Hanabusa and Andoh decide to make Ichigo the model, as they did not have the time to choose another. The match ends with a tie, meaning there will be another match. The ball starts and Ichigo is taken out by Henri-sensei, who states that he was afraid that the dress and Ichigo would be crushed. Ichigo dances with Henri-sensei, making the Sweets Princes jealous.",
,,1,45,"ボンボンショコラ・デ・ツアー
봉봉 쇼콜라 여행","Team Ichigo and Team Koshiro was led around Europe by Henri-sensei's secretary. By the time they got to the last destination in Germany, Henri-sensei announced that the rematch semi-finals would be held in the Swan Castle. Heiress claimed that if her team won, Kashino will have to marry her on the spot. Team Ichigo decided to use Ichigo's ideas from their tour around Europe and the chocolates bought by Kashino during their tour from various countries. Team Ichigo won and advances to the finals because Team Koshiro only used ingredients from Chateau Seika while Team Ichigo used ingredients from their tour around Europe.",
,,1,46,"お婆ちゃんのレシピ
할머니의 레시피","Back in Paris to prepare for the finals, Ichigo finds some scrumptious strawberries in the market, and wishes she had her grandma's recipe for the strawberry tart that had vanished from her recipe book. Meanwhile Kashino finds another vanished recipe in a book he checked out from the library. In this book, the Spirits discover traces of magic dust used by Sweets Spirits where the recipe was! Ichigo decides to head to the Sweets Kingdom to search for the old woman Spirit who gave her the spoon, because she thinks she might have been her grandma's spirit and knows where the recipe could be!",
