title,description,season,episode,episode_title,content,genre
,,1,47,"裏庭で見つけたパリ
뒷밭에서 찾은 파리","Ichigo begins intensive training in order to create her own original Strawberry Tart recipe, but is having trouble with it. When Kashino has a taste, he points out that the problem is with the strawberries and she realizes that she needs special strawberries with a unique taste like the ones her grandmother used. However, the strawberries aren't available anymore, so Ichigo decides to use Heiress's help to look for them. After traveling back to Japan using the Sweets Kingdom toy train, Ichigo samples the Heiress's top-quality strawberries, but still can't find one to suit her tart. She goes back to her grandmother's garden and finds the special patch of soil her grandmother uses. After finding a few of her grandmother's strawberries, Marron tells her that her grandmother's strawberries were called fraises de bois, and the soil that her grandmother used was from the Sweets Kingdom. Ichigo returns back home to the Sweets Princes, and later the Chairman calls Kashino to inform them that Team Tennouji lost the semi-finals in the World Cake Grand Prix.",
,,1,48,"ウソでしょ! アンリ先生
또 다른 앙리선생님","Team Tennouji lost in the semi-finals. With that shocking revelation, Team Ichigo is left wondering what to make of it. And watching the DVD of the match recorded by Chateau Seika at Team François' request, leaves them even more perplexed after seeing Mari giving a completely sloppy performance. Worried and confused, Ichigo, along with Heiress ran off to speak to her. Meanwhile the rest of Team Ichigo started to research their new rivals; Team François, by asking Lemon from Team Ricardo about them. While Lemon tells the Sweets Princes about Team François's superior skills, Mari reveals what happened before semi-finals. Henri-sensei appears and reveals his true colors while sneering at Mari for her feelings towards him. Henri states that romance is not necessary in accomplishing as a top patissiere, even going as far to look down on Ichigo's skills for the first time. Ichigo declares to Henri-sensei that they will beat Team François. Ichigo goes back to Paris and starts to practice for the finals with her team.",
,,1,49,"決戦! ベルサイユ宮殿
결전! 베르사이유 궁전","The finals of the World Cake Grand Prix has finally came and Team Ichigo and François clash in a three hour team battle with two subjects and themes; an entremet made of chocolate and plated desserts which combines hot and cold sensation. Finally, the match turns out to be a tie. The judges decides to make another match at the same day using batter as the subject and this time it will be an individual match. Andou clashes with Katie, Hanabusa matches against Isabella, Kashino battles against Dominique and the team leaders battles each other.",
,,1,50,"夢のいちごタルト
꿈의 딸기 타르트","The battle of batters ends with yet another tie, so another rematch is decided upon. Each team has to choose one representative. Ichigo, despite her protests, is chosen as the representative of Team Ichigo while François is chosen as the representative for her team. François made her specialty, Dijonaise au Chocolate as expected. Through Ichigo's strawberry tart; which Vanilla named as Sourire de l'Ange, Angels' Smiles. Team Ichigo attained victory. Ichigo now knows that Henri-sensei is playing the bad guy part to push her determination in order to surpass her grandma's tart. Before they return to Japan, Kashino and Ichigo say that they won't tell each other about their feelings since they have so much to learn (while they affectionately hold hands).",
,,2,51,"マリーズ・ガーデン〜解散!チームいちご〜
해산! 딸기팀","Ichigo's two years of studying abroad in Paris are over and she returns to Japan. But when she gets to school, none of the members of Team Ichigo seems to be around. It turns out that Hanabusa and Andoh are taking leaves of absence from school to pursue their own dreams. Kashino reveals that because he had the best grades in the Paris Campus throughout his whole studies there, he was allowed to skipped a grade and become a second year in the same class as the Heiress. Lemon, who has transferred from Paris to Japan, was also allowed to skip a grade and is now in Group A with Ichigo, Rumi, and another member. Later, while in the Salon de Marie, Ichigo meets Johnny McBeal, the final member of A group. While praying to the Queen Sweets Spirit statue, Ichigo meets Mari who reveals that she is living in New York working on Henri's new ""project"". Ichigo receives a letter from Henri-sensei, telling her to meet him at a location to discuss something. When she goes to the meeting place, she finds that Johnny, Kashino, and Lemon all got the same letter. Henri tells them he wants them to run sweets shops on the main street of his new project, ""Marie's Garden"" named after his grandmother.",
,,2,52,"マリーズ・ガーデン〜ジョニーとメイズ〜
죠니와 메이즈","Before Ichigo and company can start to work, Johnny's Sweets Spirit Maize freaks out on them because of etiquette. Kashino, Lemon, and Ichigo also find out that Koshiro-san and Johnny are cousins. Henri-sensei announces that the first shops on street one are going to open within the week and the owners are from different countries allowing different types of sweets to surface. To their surprise, the Japanese sweet shop is run by Andoh with Kana and her friends as waitresses. The shops will be ranked on popularity and sales; the least well-received shop will be closed and a new shop will replace it and the cycle continues. The four of them decide to host a contest to decide on the group leader.",
,,2,53,"マリーズ・ガーデン〜新チームいちご?〜
새로운 딸기팀?","Everybody's getting ready for the opening. In the end the sales are going bad. Kashino still doesn't understand that Johnny might steal Ichigo away from him. However, the shop are running out of funds which means the shop might go bankrupt before it even opens. Lemon and Johnny wanted to get funds from Miya but Kashino disagreed. Ichigo scolded them for being split up when they are opening a shop together. When they went to Andoh's shop to visit, he does not have much customers. Manager Sully turns up and told Andoh that he might have to close down the shop if he doesn't get enough sales.",
,,2,54,"マリーズ・ガーデン〜チャンスロスと廃棄ロス〜
기회손실과 폐기손실","Andoh's shop is on the verge of closing down. Shocked and worried, he catches a fever which makes Caramel very worried about him. He then collapses, and when he wakes up he finds all his friends and his grandfather come to visit him. Johnny, Kashino, and his grandfather scold him and point out his mistakes for pushing himself to hard and try to so everything alone. Caramel also gives out her advice to Andoh that he has to rely on other people more. Hanabusa turns up for a visit.",
,,2,55,"スイーツ王国ツアー〜スピリッツで秘境探険〜
요정들의 비밀 탐험",The Sweets Spirits get a letter from Andy back in the Sweets Kingdom asking for their help with a project. The Sweets Spirit and the new Team Ichigo head to the Sweets Kingdom for a break and to help the Jerks.,
,,2,56,"スイーツ王国ツアー〜バウムの森で迷って〜
바움 숲을 헤매다","Ichigo and her friends plan to go to all the remaining places in one day. They pass easily through the Powder Desert and the Milky Lake, but when they reach the Baum Forest, they find themselves in a mystery. Someone has been leaving garbage in the forest and the Master of the Forest believes that Kasshi and the Jerks have done it, leaving them in a cell. Now, Ichigo and the gang have to think up of a way to save her friends and find the culprit before the Jerks have to take the exam.",
,,2,57,"スイーツ王国ツアー〜旅で見つけた宝物〜
여행에서 찾은 보물",The Egg Home turns out to be more than expected and everyone in the groups learns a lesson. The Jerks make their sweets for their exam and hope for the best.,
,,2,58,"ダンス&ラプソディ〜ロンリー・ハート〜
론리 하트","Ichigo and the others are called by Henri-sensei to go to New York to help Mari with her shop, as her business is doing poorly. When they arrive they end up meeting Rick and he tells them the problem, but before they can help Mari suggests that they go sightseeing.",
,,2,59,"ダンス&ラプソディ〜ステップ・アップ〜
스텝 업","Ichigo and her friends, on their visit to New York, try to help Mari with Pâtisserie La Liberté's business. In the end of the episode, Henri-sensei calls and said if they didn't pass a specific goal, Mari cannot keep the shop. Hanabusa comes to the shop.",
,,2,60,"ダンス&ラプソディ〜マイ・スイート・ホーム〜
마이 스위트 홈","Pâtisserie La Liberté's business has increased after they made the coupon plan. Hanabusa thought that they should change the concept of the store and Ichigo and her friends ask Mari to take a day-off. In the end of the episode, Henri-sensei called and said they have passed their goal.",
,,2,61,"モーニング・グローリー〜嵐の夜〜
폭풍의 밤","As Ichigo and her team return from New York and about to set up their shop, Miya and Johnny challenged Ichigo, Kashino and Lemon. If they lose, Kashino must marry Miya and Ichigo will have to date Johnny until they get married. Hanabusa and Andou help them to set up their shop and create some new sweets. Also Andou and Hanabusa points out Kashino's love toward Ichigo.",
,,2,62,"モーニング・グローリー〜冷たい夜〜
차가운 밤","Ichigo and her team (with the help of Hanabusa and Andou) open up their shop while Miya and Johnny's shop called ""Beautiful Night Castle"" becomes a big hit. Will Ichigo and her gang be able to beat Miya's and Johnny's shop?",
,,2,63,"モーニング・グローリー〜聖なる夜〜
약속의 밤","Thanks to the help from their friends, Ichigo and the others are slowly catching up to Oujou and Johnny despite the overwhelming difference of sales. A message is sent by Honey-sama and once again Kashino's love for Ichigo is on the spotlight. On Christmas Eve, the battle will be decided by Christmas Cake. The battle results in a tie but Johnny admits that they did not actually win. Walking along the frozen pond, a confession occurs.... but Miya and Johnny choose to interfere with this perfect moment. Then Miya and Johnny push Ichigo and Kashino in the bushes which causes them to fall onto each other, kissing. After that, Ichigo received a call from Henri-sensei, saying that he's opening a Marie's Garden in London. Ichigo and Kashino decides to go and the episode ends with Miya and Johnny chasing Kashino and Ichigo who are running and holding each others hands.",
